[
  {
		"id": 1,
		"name": "SHapley Additive exPlanations (SHAP)",
		"description": "SHAP provides explanations by calculating how much each input feature contributes to a model's prediction. It assigns an importance score to each feature, showing whether the feature pushes the prediction toward or away from the expected outcome. The method works by systematically evaluating how predictions change when features are included or excluded, similar to calculating fair contributions in team scenarios.",
		"assurance_goals": ["Explainability"],
		"tags": [
			"applicable-models/agnostic",
			"assurance-goal-category/explainability",
			"assurance-goal-category/explainability/feature-analysis",
			"assurance-goal-category/explainability/feature-analysis/importance-and-attribution",
			"data-requirements/no-special-requirements",
			"data-type/tabular",
			"evidence-type/quantitative-metric",
			"expertise-needed/statistics",
			"explanatory-scope/global",
			"explanatory-scope/local",
			"lifecycle-stage/model-development",
			"technique-type/algorithmic"
		],
		"example_use_cases": [
			{
				"description": "Explaining why a complex model (like a neural network) made a specific prediction by showing how each feature influenced that prediction.",
				"goal": "Explainability"
			},
			{
				"description": "Identifying which factors contributed most to a loan approval decision in a financial model using SHAP values.",
				"goal": "Explainability"
			}
		],
		"limitations": [
			{
				"description": "Assumes feature independence, so results can be less reliable when features are highly correlated."
			},
			{
				"description": "Computationally intensive for large models or datasets (calculating many Shapley values is slow)."
			}
		],
		"resources": [
			{
				"title": "shap/shap",
				"url": "https://github.com/shap/shap",
				"source_type": "software_package"
			},
			{
				"title": "Introduction to SHapley Additive exPlanations (SHAP) \u2014 XAI Tutorials",
				"url": "https://xai-tutorials.readthedocs.io/en/latest/_model_agnostic_xai/shap.html",
				"source_type": "tutorial"
			},
			{
				"title": "An empirical study of the effect of background data size on the stability of SHapley Additive exPlanations (SHAP) for deep learning models",
				"url": "http://arxiv.org/pdf/2204.11351v3",
				"source_type": "technical_paper",
				"authors": [
					"Han Yuan",
					"Mingxuan Liu",
					"Lican Kang",
					"Chenkui Miao",
					"Ying Wu"
				],
				"publication_date": "2022-04-24"
			},
			{
				"title": "SHAP: Shapley Additive Explanations | Towards Data Science",
				"url": "https://towardsdatascience.com/shap-shapley-additive-explanations-5a2a271ed9c3/",
				"source_type": "tutorial"
			},
			{
				"title": "MAIF/shapash",
				"url": "https://github.com/MAIF/shapash",
				"source_type": "software_package"
			}
		],
		"complexity_rating": 3,
		"computational_cost_rating": 3,
		"related_techniques": [5, 6, 7, 12, 27, 28]
  },
  {
    "id": 2,
    "name": "Permutation Importance",
    "description": "Permutation importance measures a feature's importance by shuffling its values and observing the impact on model performance. If the model's accuracy drops significantly when a feature is permuted, that feature is considered important.",
    "assurance_goals": [
      "Explainability"
    ],
    "tags": [
      "applicable-models/agnostic",
      "assurance-goal-category/explainability",
      "assurance-goal-category/explainability/feature-analysis",
      "assurance-goal-category/explainability/feature-analysis/importance-and-attribution",
      "data-requirements/no-special-requirements",
      "data-type/tabular",
      "evidence-type/feature-importance",
      "expertise-needed/statistics",
      "explanatory-scope/global",
      "lifecycle-stage/model-development",
      "technique-type/algorithmic"
    ],
    "example_use_cases": [
      {
        "description": "Assessing which features are most important in a trained Random Forest by measuring performance drop when each feature's values are shuffled.",
        "goal": "Explainability"
      },
      {
        "description": "Checking that a model is not relying on an irrelevant field by confirming that shuffling that field doesn't change the model's accuracy.",
        "goal": "Explainability"
      }
    ],
    "limitations": [
      {
        "description": "Can be misleading when features are correlated, and computationally expensive on high-dimensional datasets due to repetitive model evaluations."
      }
    ],
    "resources": [],
    "complexity_rating": 2,
    "computational_cost_rating": 2,
    "related_techniques": [
      3,
      4,
      10
    ]
  },
  {
    "id": 3,
    "name": "Mean Decrease Impurity",
    "description": "Mean Decrease Impurity measures how much each feature helps improve decision-making in tree-based models like Random Forest. It calculates how much 'disorder' each feature reduces when making splits in the decision trees. Features that create cleaner, more organized splits receive higher importance scores.",
    "assurance_goals": [
      "Explainability"
    ],
    "tags": [
      "applicable-models/tree-based",
      "assurance-goal-category/explainability",
      "data-requirements/no-special-requirements",
      "data-type/tabular",
      "evidence-type/quantitative-metric",
      "expertise-needed/statistics",
      "explanatory-scope/global",
      "lifecycle-stage/model-development",
      "technique-type/algorithmic"
    ],
    "example_use_cases": [
      {
        "description": "Determining important features in Random Forest classification tasks.",
        "goal": "Explainability"
      }
    ],
    "limitations": [
      {
        "description": "Biased towards features with more splits or categories; only applicable to tree-based models and can overestimate importance of high-cardinality features."
      }
    ],
    "resources": [],
    "complexity_rating": 2,
    "computational_cost_rating": 1,
    "related_techniques": [
      2,
      4,
      10
    ]
  },
  {
    "id": 4,
    "name": "Coefficient Magnitudes (in Linear Models)",
    "description": "Examines the absolute values of coefficients in linear models to judge feature influence. Features with larger absolute coefficients have a stronger impact on the prediction, and the sign of a coefficient shows if it pushes the outcome up or down.",
    "assurance_goals": [
      "Explainability"
    ],
    "tags": [
      "applicable-models/linear-model",
      "assurance-goal-category/explainability",
      "data-requirements/no-special-requirements",
      "data-type/tabular",
      "evidence-type/quantitative-metric",
      "expertise-needed/low",
      "explanatory-scope/global",
      "lifecycle-stage/model-development",
      "technique-type/metric"
    ],
    "example_use_cases": [
      {
        "description": "Interpreting which features influence housing price predictions in linear regression.",
        "goal": "Explainability"
      }
    ],
    "limitations": [
      {
        "description": "Only valid for linear relationships; can be affected by feature scaling and multicollinearity, and does not capture non-linear importance."
      }
    ],
    "resources": [],
    "complexity_rating": 1,
    "computational_cost_rating": 1,
    "related_techniques": [
      2,
      3,
      10
    ]
  },
  {
    "id": 5,
    "name": "Integrated Gradients",
    "description": "Integrated Gradients explains predictions by calculating how much each input feature contributes to the final output. It works by gradually changing each feature from a neutral starting point (baseline) to its actual value, measuring the model's sensitivity to these changes step by step. This produces importance scores showing which features most influenced the prediction.",
    "assurance_goals": [
      "Explainability"
    ],
    "tags": [
      "applicable-models/neural-network",
      "assurance-goal-category/explainability",
      "data-requirements/labelled-data",
      "data-requirements/reference-dataset",
      "data-type/tabular",
      "evidence-type/quantitative-metric",
      "expertise-needed/ml-engineering",
      "expertise-needed/statistics",
      "explanatory-scope/local",
      "lifecycle-stage/model-development",
      "technique-type/algorithmic"
    ],
    "example_use_cases": [
      {
        "description": "Understanding pixel contributions in image classification with deep neural networks.",
        "goal": "Explainability"
      }
    ],
    "limitations": [
      {
        "description": "Requires a meaningful baseline input; results can be sensitive to the choice of baseline and model must be differentiable, limiting use with non-differentiable components."
      }
    ],
    "resources": [],
    "complexity_rating": 4,
    "computational_cost_rating": 3,
    "related_techniques": [
      1,
      6,
      7,
      12,
      27,
      28
    ]
  },
  {
    "id": 6,
    "name": "DeepLIFT",
    "description": "DeepLIFT assigns credit (or blame) to each input feature by comparing a neuron's activation to a reference (baseline) and tracking the difference backward through the network. It attributes the change in the output to changes in each input feature relative to what the output would be at the reference input.",
    "assurance_goals": [
      "Explainability"
    ],
    "tags": [
      "applicable-models/neural-network",
      "assurance-goal-category/explainability",
      "data-requirements/access-to-model-internals",
      "data-requirements/access-to-training-data",
      "data-requirements/labelled-data",
      "data-requirements/reference-dataset",
      "data-type/graph",
      "evidence-type/quantitative-metric",
      "expertise-needed/ml-engineering",
      "explanatory-scope/local",
      "lifecycle-stage/model-development",
      "technique-type/algorithmic"
    ],
    "example_use_cases": [
      {